directspeech	... Que voulez-vous de moi ?... Qu'avons-nous fait ?... Qu'espérez-vous ?... Pourquoi, depuis deux jours, êtes-vous entré de force dans notre vie et ne nous laissez-vous plus un instant de repos ?... Un crime s'est commis près de nous... Est-ce donc la faute de ma pauvre petite fille ?... Est-ce donc ma faute, à moi ?... Vous outrepassez votre devoir... Votre zèle vous emporte trop loin... La chambre d'une femme devrait vous être sacrée... et ce qui devrait vous être plus sacré encore, c'est l'innocence de cette enfant, ce sont ses terreurs, ce sont ses larmes... Allez-vous-en, vous dis-je... J'ai le droit de vous ordonner de partir, et je ne veux pas que vous restiez ici plus longtemps.
directspeech	... Qu'avons-nous fait ?... Qu'espérez-vous ?... Pourquoi, depuis deux jours, êtes-vous entré de force dans notre vie et ne nous laissez-vous plus un instant de repos ?... Un crime s'est commis près de nous... Est-ce donc la faute de ma pauvre petite fille ?... Est-ce donc ma faute, à moi ?... Vous outrepassez votre devoir... Votre zèle vous emporte trop loin... La chambre d'une femme devrait vous être sacrée... et ce qui devrait vous être plus sacré encore, c'est l'innocence de cette enfant, ce sont ses terreurs, ce sont ses larmes... Allez-vous-en, vous dis-je... J'ai le droit de vous ordonner de partir, et je ne veux pas que vous restiez ici plus longtemps.
directspeech	... Qu'espérez-vous ?... Pourquoi, depuis deux jours, êtes-vous entré de force dans notre vie et ne nous laissez-vous plus un instant de repos ?... Un crime s'est commis près de nous... Est-ce donc la faute de ma pauvre petite fille ?... Est-ce donc ma faute, à moi ?... Vous outrepassez votre devoir... Votre zèle vous emporte trop loin... La chambre d'une femme devrait vous être sacrée... et ce qui devrait vous être plus sacré encore, c'est l'innocence de cette enfant, ce sont ses terreurs, ce sont ses larmes... Allez-vous-en, vous dis-je... J'ai le droit de vous ordonner de partir, et je ne veux pas que vous restiez ici plus longtemps.
directspeech	... Pourquoi, depuis deux jours, êtes-vous entré de force dans notre vie et ne nous laissez-vous plus un instant de repos ?... Un crime s'est commis près de nous... Est-ce donc la faute de ma pauvre petite fille ?... Est-ce donc ma faute, à moi ?... Vous outrepassez votre devoir... Votre zèle vous emporte trop loin... La chambre d'une femme devrait vous être sacrée... et ce qui devrait vous être plus sacré encore, c'est l'innocence de cette enfant, ce sont ses terreurs, ce sont ses larmes... Allez-vous-en, vous dis-je... J'ai le droit de vous ordonner de partir, et je ne veux pas que vous restiez ici plus longtemps.
directspeech	... Un crime s'est commis près de nous... Est-ce donc la faute de ma pauvre petite fille ?... Est-ce donc ma faute, à moi ?... Vous outrepassez votre devoir... Votre zèle vous emporte trop loin... La chambre d'une femme devrait vous être sacrée... et ce qui devrait vous être plus sacré encore, c'est l'innocence de cette enfant, ce sont ses terreurs, ce sont ses larmes... Allez-vous-en, vous dis-je... J'ai le droit de vous ordonner de partir, et je ne veux pas que vous restiez ici plus longtemps.
directspeech	... Est-ce donc ma faute, à moi ?... Vous outrepassez votre devoir... Votre zèle vous emporte trop loin... La chambre d'une femme devrait vous être sacrée... et ce qui devrait vous être plus sacré encore, c'est l'innocence de cette enfant, ce sont ses terreurs, ce sont ses larmes... Allez-vous-en, vous dis-je... J'ai le droit de vous ordonner de partir, et je ne veux pas que vous restiez ici plus longtemps.
directspeech	... Vous outrepassez votre devoir... Votre zèle vous emporte trop loin... La chambre d'une femme devrait vous être sacrée... et ce qui devrait vous être plus sacré encore, c'est l'innocence de cette enfant, ce sont ses terreurs, ce sont ses larmes... Allez-vous-en, vous dis-je... J'ai le droit de vous ordonner de partir, et je ne veux pas que vous restiez ici plus longtemps.
nondirect	 ¶ Un mot très froid du commissaire de police la rappela à la raison.
directspeech	 ¶ -- Puisque, votre fille et vous, vous prétendez n'avoir rien vu du meurtre de Larouette, comment devinez-vous que nous voulons reconstituer la scène du crime ?...
directspeech	...
nondirect	 ¶ Elle se tut, baissant le dos.
nondirect	 Puis, après un moment, d'une voix faible et suppliante : ¶ 
directspeech	-- De grâce, monsieur... par pitié, laissez-nous.
nondirect	 ¶ Lacroix avait pris doucement Suzanne par la main.
nondirect	 Il disait : ¶ 
directspeech	-- Puisqu'elle n'a rien vu, d'où vient sa frayeur ?... Et pourquoi ne veut-elle pas monter avec moi sur le balcon ?...
directspeech	... Et pourquoi ne veut-elle pas monter avec moi sur le balcon ?...
directspeech	...
nondirect	 ¶ Suzanne, tout à coup, s'éloigna de sa mère et la regarda en face.
nondirect	 Et ce regard consolait la pauvre femme et disait clairement : ¶ 
directspeech	-- Ne crains rien. Je te comprends. Je suis forte !...
directspeech	 Je te comprends. Je suis forte !...
directspeech	 Je suis forte !...
directspeech	...
nondirect	 ¶ Et elle se laissa entraîner sur le balcon.
nondirect	 ¶ En face, dans la petite chambre meublée d'acajou, comme au soir du crime, un homme était assis devant son secrétaire ouvert, et faisant mine de compulser des papiers.
nondirect	 Cet homme, qui occupait la place de Larouette, c'était l'un des agents : Tristot.
nondirect	 Derrière lui, sur la table qui occupait le milieu de la pièce, une bougie brûlait dans un chandelier de faïence, la même bougie qui avait éclairé le crime.
nondirect	 ¶ Lacroix toucha du doigt l'épaule de Suzanne.
directspeech	 ¶ -- Regarde, mon enfant,
directspeech	 dit-il... et, si tu as vu, tu te souviendras !...
directspeech	...
nondirect	 ¶ Soudain, apparut dans la rue un homme de haute taille, coiffé d'un chapeau haut de forme, de couleur grise, bordé d'un large ruban noir -- la lune permettait de distinguer ces choses --, et vêtu d'un pardessus gris à pèlerine.
nondirect	 ¶ Cet homme, c'était l'autre agent, Pivolot ; le vêtement et le chapeau étaient ceux de Roger Laroque, le soir du crime.
nondirect	 ¶ Il traversa les marronniers et pénétra chez Larouette.
nondirect	 Un instant après, il entrait doucement dans la chambre où Tristot travaillait, sans défiance à son secrétaire.
nondirect	 ¶ Mais, tout à coup, Pivolot ayant remué une chaise, Tristot se retourna, l'aperçut, et les deux agents firent mine de se jeter l'un sur l'autre, car d'après la déposition du médecin, la posture du cadavre, l'état des lieux, Lacroix n'avait pas eu de peine à reconstituer la scène du meurtre.
nondirect	 ¶ Et l'on voit qu'il ne s'était pas trompé.
directspeech	 ¶ -- On distingue parfaitement
nondirect	, murmura le commissaire de police.
directspeech	 Il est évident, pour moi, qu'une personne placée ici, au moment de l'assassinat, devait ne perdre aucun détail. Or, comme madame Laroque et sa fille se trouvaient -- Victoire l'affirme -- sur le balcon, il est facile de conclure qu'elles ont tout vu...
directspeech	 Or, comme madame Laroque et sa fille se trouvaient -- Victoire l'affirme -- sur le balcon, il est facile de conclure qu'elles ont tout vu...
nondirect	 ¶ Il avait tenu, tout le temps de cette scène, Suzanne par la main.
nondirect	 Il espérait surprendre un tressaillement -- à l'apparition, surtout, de l'agent vêtu des habits de son père.
nondirect	 Mais la main brûlante de l'enfant était restée inerte dans la sienne.
nondirect	 ¶ Il se pencha sur elle et la regarda de très près.
nondirect	 Alors, il vit qu'elle avait les yeux si obstinément fermés, et avec tant de force, que les paupières formaient sur eux mille rides.
nondirect	 ¶ Elle avait voulu ne rien voir, et elle n'avait rien vu !
directspeech	 ¶ -- Sublime enfant !
