72	0.05556	coeur madame âme amour aimer yeux soin voeu ardeur amant souffrir doux sentiment flamme plaire secret choix espoir beau aveu paraître trouver bonheur jaloux feux honneur désir expliquer toucher sentir entendre mérite doute respect tendresse estime appas tendre bonté croire faveur digne prétendre bouche soupir plaindre éclater montrer mériter permettre 
73	0.05556	fille père femme mariage épouser marier bien enfant mari maison gendre mère jeune chose bon famille plaire beau aimer homme raison honneur âge laisser fils riche dieu crois vivre hymen entendre tête époux sage apprendre prier soin vrai beau-père prétendre nom esprit affaire ouïr honnête content monde vieux passer soir 
74	0.05556	seigneur empereur gloire empire jour soin grandeur rang moment nom faveur univers vertu fortune régner bonté temps heureux même peuple passer auguste jours honneur puissance éclat lieux bonheur seul loi trône premier désir souvenir vivre cour secret nouveau maître suivre ordre bienfait exploit victoire jouir flatter oublier fois élever changer 
75	0.05556	croire connaître vrai secret cacher erreur faux craindre surprendre douter madame nom abuser tromper yeux vérité effet vain soupçon paraître éclaircir rapport doute imposteur écouter assurer imposture apprendre oser même feindre discours confus étonner naître foi lieu fourbe bruit voix avoir seul cru expliquer grâce nommer découvrir croit avouer intérêt 
76	0.05556	père hymen fille époux coeur amour unir noeud loi bonheur main voeu foi sort heureux choix doux jour hyménée ciel attendre cher droits honneur recevoir obtenir fils consentir prétendre aimer espoir former vain famille lien destin oser aveu feux joindre naître promettre mère épouser obéir gendre refus destiner presser céder 
77	0.05556	dieu chrétien dieux ciel foi coeur âme seigneur grâce mourir sang suivre erreur yeux mort gloire cher terre saint cieux vivre loi zèle vie même souffrir lieu empereur abandonner quitter tourment monde faux religion flamme puissance honteux par effet puissant trépas courage vertu penser autel supplice bonheur tenir glorieux adoré 
78	0.05556	cour aimer amour yeux jour haïr haine cours prince seigneur âme craindre secret soin plaire crois bouche oser souffrir amant oïl objet mal ardeur offrir hymen désir cruel appas sentir empire trahir flamme avouer foi toucher extrême sentiment ingrat croire emporter colère faiblesse temps cacher cher suivre charme mettre peine 
79	0.05556	madame monsieur bon petit chose aimer trouver affaire plaisir plaire attendre femme enfant jeune entendre affaires mettre moins monde mari mère heureux mariage finette beau cher moment tante pauvre laisser manière demander peine vrai prier fait paraître perdre esprit temps mauvais moyen devenir tenir amoureux marier connaître joli bonheur songer 
80	0.05556	chanter amour danser jouer petit musique air fille jeu danse entendre montrer voix fête finir plaisir chanson femme violon amant rire concert docteur jour premier vif fois joli noce théâtre taire payer doux charmer amoureux jeune musicien défendre gille divertissement ballet accompagner plaire beau chant exprimer tendre italien mariage chercher 
81	0.05556	malheur mal sort douleur perdre malheureux souffrir coup plaindre mort triste ciel destin cruel fortune suivre trouver laisser servir dieux état pitié perte mourir disgrâce peine ôter rigueur extrême ami mortel désespoir seul secours bien funeste vie rigoureux ennui tourment vivre misère abandonner fatal heureux réduire quitter conserver changer bonheur 
82	0.05556	secret ami craindre connaître soin dessein cacher assurer attendre apprendre temps surprendre servir seul soupçon ordre arrêter projet découvrir mystère instruire maître mettre zèle paraître coup conduire lieux part jour important crois entreprendre péril crainte sûr confier besoin même tenir offrir moment ignorer avis enlever doute jours foi courir tromper 
83	0.05556	seigneur coeur dieux père lieux cruel malheureux vain sort soin fureur seul ciel amour moment affreux vertu craindre fuir oser malheur yeux horreur jour cher douleur funeste courroux coup immoler offrir laisser pleur accabler attendre odieux effroi transports prince vengeance nom entendre sang barbare juste jours frémir âme destin sentir 
84	0.05556	duc trouver comte duchesse laisser voix seigneur cour ordre sortir lieu peine perdre apprendre justice sujet assurer entendre suivre esprit mépris chercher garder instant charme croire caprice éclat soin raison sentir faudrait avoir retirer fois servir naître vain vieux presser ouïr beauté remettre coûter moment partir expliquer passer témoin sort 
85	0.05556	lieux chercher père fuir sort cour malheur destin quitter nom jour laisser partir jours heureux attendre séjour fils espoir étranger cacher ami soin malheureux triste peine nouveau fois pas éloigner vie vit temps asile mal changer absence apprendre bonheur pays fortune ciel climat perdre secours retour long départ croire recevoir 
86	0.05556	bian petit fille femme aimer pis seoir enfant bon garçon gros chose coup bâiller pauvre vrai joli village homme tête dame épouser fin morguer mourir esprit penser regarder devenir tenir cousin parole mettre beau gager fois vêler paysan lire bout même tirer baiser violette coeur choir fâcher tourner bouter jaloux 
87	0.05556	mort sang fureur tyran main sauver venger périr coup seigneur sort crime perdre dessein vie mourir servir bras lâche suivre jours vengeance trahir péril craindre haine zèle vain laisser immoler victime attendre trépas effort dieux secours malheur défendre oser ennemi perfide destin ami rage punir courir seul armer cruel arrêter 
88	0.05556	bon monsieur beau maître diable valet coup rire fou mettre adieu entendre sot dieu homme grâce foi fois car battre plaire enrager tenir jouer mot sortir pauvre heure taire apprendre crois nuit traître penser petit ferai peste vrai coeur lieu passer peur rompre valoir certain revenir logis tête discours sorte 
89	0.05556	vie femme dernier malheur être ennemi mort porter même honneur fortune tenir suivre parole trouver mourir perte fille ruine sentiment servir vivre résoudre père seul exemple laisser action propre courage fort ôter sauver ouvrir âme recevoir premier grâce moitié vaincre demander condition réduire résolution disposer refuser dépendre liberté nature meilleur 
