0	0.01144	manger boire table souper servir dîner monsieur docteur air part repas cher mettre chère faim capitaine milady prince intendant plat haut cuisine appétit nom voleur hôtellerie mets nommer possible ragoût montrer voyage monseigneur souvenir pendre apporter regarder arriver milord coucher porter viande habit cabaret oublier cuisinier fromage compagnon ferez diligence 
1	0.06071	bon diable beau monsieur coup mettre foi maître valet homme tenir fou entendre dieu battre temps peur main rire sot petit laisser pauvre penser passer fois pied adieu tête épée boire tirer appeler nez mourir enrager corps manger sortir dent jouer chose heure nuit apprendre ferai perdre pendre coeur feu 
2	0.0139	mal monsieur médecin guérir malade remède santé homme maladie fou jours art chose docteur science esprit fille astrologie médecine effet cause mourir guérison gens soutenir habile vrai sens astrologue savant humeur folie connaître sentir secours émétique corps impatience grâce goutte merveilleux consulter nièce tempérament causer secret poumon avis saigner tousser 
3	0.02973	monsieur oncle bien épouser nièce mère bon homme laisser tante mariage veuve femme testament marier signer affaire contrat notaire amour dorer neveu riche héritier maître madame entendre vrai fortune mari entrer parent promettre perdre intérêt marquise moment charmer jeune raison chercher mettre ouïr parole chevalier moins certain tort succession haïr 
4	0.01083	enfant monsieur père ami frère femme commandeur homme entendre oncle falloireuil soeur rester peine regarder vie appeler devenir bras asseoir attendre moment arriver perdre tête fortune ouvrage bon maîtresse connaître bonheur passer recevoir penser aimer jeter continuer éloigner famille obtenir méchant conduite lever chagrin nièce malheureux apercevoir honnête soupirer parent 
5	0.21179	amour aimer coeur âme beau yeux amant flamme ardeur plaire objet doux charmer feu secret feux trouver appas soin sentir beauté désir jour soupir voeu charme aimable raison soupirer espoir sentiment passion peine jaloux extrême tendre souffrir amoureux brûler respect mérite seul moment naître cacher faveur enflammer plaisir regard servir 
6	0.03962	lettre lire écrire billet main tenir écrit papier lettres porter recevoir attendre seul monsieur remettre lit envoyer présent mots premier adieu nom servir écriture continuer trouver esprit promettre part dernier mot plume maître montrer valet demander apprendre réponse adresse permettre jeter fidèle croit coup fin partir mépris revenir amant certain 
7	0.02463	fers vainqueur seigneur liberté prison captif chaîne prince âme prisonnier briser vertu esclave sortir captivité malheur camp maître offrir enchaîner vaincre époux sort lâche accorder esclavage généreux rançon tirer délivrer traiter brave générosité lien reprendre tenter fille porter univers souffrir rompre victoire former clémence demander moitié rigueur illustre tente prix 
8	0.01415	chanter danser amour musique jouer danse air petit jeu voix violon beau chanson théâtre vif montrer entendre fête finir ballet concert doux docteur rire chant musicien gille italien charmer représenter pied plaire divertissement apollon couplet charlatan instrument beauté joli folie amant carte entrée goûter fille sauter accompagner noce douceur accorder 
9	0.20745	connaître croire secret craindre cacher surprendre madame apprendre oser soupçon yeux douter tromper discours effet même vrai faux erreur paraître nom tenir répondre feindre doute entendre vérité découvrir éclaircir étonner seul ami crois avoir abuser rapport perdre grâce croit expliquer ignorer lieu confus cru moins écouter crainte vain taire point 
10	0.06819	frère soeur aimer amour amant coeur amitié même connaître haïr prince cher père ennemi temps haine parti nature nom ôter ciel contrahir sang plaindre douceur colère foi intérêt fuir regarder mettre guerre malheureux aîné prévenir moins rompre paix faudra chercher vengeance oeil aveugle passion promettre accorder choisir nouvelle croire partage 
11	0.00588	sultan empereur vizir esclave sérail empire sultane amurer soldat frère ottoman ordre vit troupe prince janissaire brave mutin vengeance mufti imprudent tête combat macassar peuple marcher côté milice sacré murmurer musulman conseil audace terreur nombre effrayer trône public dégrader flotte douloureux murmure feindre hautesse courageux enceindre embarquer rumeur portes chef 
12	0.19217	amour beau yeux esprit beauté dessein âme tenir trouver discours bien coeur dieux flamme peine obliger plaisir objet désir mal jour seul mettre temps aimer doux amant effet même amoureux ravir croire espérer plaire porter faveur servir recevoir vie ami sujet suivre charme souffrir montrer appas crois baiser lieu bouche 
13	0.08458	yeux lieux cour jour secret temps plaire soin plaisir nouveau éclat heureux jeune chercher sembler jours charme long par gloire regard paraître nom beauté séjour art plein passer fortune présent désir offrir honneur voix briller vit vue bruit laisser ignorer premier monde joie étonner honorer mortel profond empire naître bouche 
14	0.03326	cour aimer amour seigneur yeux haine haïr duc jour prince âme soin cours faiblesse oïl cruel objet doux plaire sentir souffrir bouche craindre demander laisser ingrat peine empereur secret mépris offrir hymen abandonner obéir perdre orgueil trahir flamme obtenir faveur force princesse foi croire dépit état toucher éteindre désir crois 
15	0.00604	bian pis aimer seoir gros bâiller morguer dame petit vêler village fin bouter tête même lot pays voûte pari lire chose tirer coeur femme voûter pasquin baron être gager batifoler amoureux penser fâcher coup pus regarder écrevisse garçon paysan vrai ouïr tante feu boire choir esprit avis jeanne sottise cou 
16	0.01374	marquis duc monsieur cousin comtesse duchesse comte baron épouser cher madame cour noble noce nom chevalier soir signer noblesse honneur seigneur montrer qualité plaire entendre mathieu embrasser connaître orgueil oncle rire appeler gens oublier milan sortir arrêter gentilhomme titre benjamin pot-de-vin diable foi commandeur soutenir adieu part roturier bourgeois écrire 
17	0.02763	vaisseau mer bord eau port rivage orage flot naufrage terre vents onde vent étranger jeter découvrir sembler corsaire danger secours flotte élever long bruit embarquer jeune avoir arriver prêt tempête climat lieux pousser envoyer rive aborder île vieux ville éloigner matelot fortune rocher force tête lâche voyage ouïr tyran dieux 
18	0.05479	amour aimer bien gloire coeur mal montrer croire craindre penser dessein moins ennemi vertu esprit victoire haine courage prince peine main sire bras sujet crois seul vaincre demander glorieux couronne même raison généreux mettre âme honneur vrai force servir pays paix croit souhaiter fortune monarque extrême perdre puissant trône contenter 
19	0.1435	bon beau trouver esprit plaire homme connaître rire crois croire chose tenir aimer passer foi valoir humeur penser monsieur servir laisser gens mettre affaire temps jouer sembler car fin moins jour maître vrai fois mot être quitter air adieu entendre peine doute heure discours doux taire certain obliger apprendre façon 
20	0.04513	âme esprit recevoir ennemi perdre reine bon dernier ingrat grâce amitié malheur conserver bonté vie permettre souffrir coeur discours souvenir connaître repos ami dessein madame par obliger raison salut regret perte sang juste bien soin fortune mourir servir ciel cher comte passion vertu action dieu haut maison état avoir seul 
21	0.01562	grec dieux trahir troyen seigneur autel ilion vaisseau camp seul sang demander héros bord fils fille mère vents vainqueur prix conduire haine cendre mer entier venger croire diane refus armes rivage victime rougir courroux proie sacrifice exploit diton joie voix entendre immortel pied patrie sparte misère temple tombeau défendre nom 
22	0.1609	seigneur soin lieux secret craindre dessein seul courroux coeur vain projet zèle espoir oser jour fureur ennemi sort vertu ciel foi attendre main yeux péril ordre jours moment peuple malheur laisser gloire vengeance soupçon haine cours flatter destin prévenir offrir servir discours effroi même trouble entendre chercher ignorer intérêt fidèle 
23	0.15684	coeur madame seigneur amour yeux dieux pleur douleur gloire aimer cruel malheur âme moment rival soin amant funeste craindre larme sort triste tendresse haine soupir attendre jour entendre transports voeu lieux princesse père sentir flamme feux fureur croire accabler malheureux fatal oser chercher destin fois héros apprendre trouble juste oublier 
24	0.09109	crime punir loi grâce coupable demander justice juste criminel mort supplice courroux condamner pardonner arrêt repentir bonté même juge ciel pardon peine juger mériter colère écouter sujet pitié permettre défendre clémence seul coeur yeux rigueur peuple falloire faveur souffrir plaindre légitime bouche exemple oublier obéir forfait suivre sévère audace innocent 
25	0.14714	coeur vertu cher aimer père ciel vie malheureux seul cruel yeux âme craindre connaître entendre douleur pardonner tendre moment bonheur tendresse affreux laisser croire larme secret moins daigner fuir sentiment tromper sort sentir oublier jours heureux oser ami mériter pleurer instant genou amour accabler état pitié trembler attendrir demander amitié 
26	0.17333	hymen époux heureux amour bonheur main foi jour coeur doux noeud unir voeu attendre soin sort recevoir ciel choix honneur prix cher hyménée promettre père loi laisser consentir épouser joie fille bien plaire penser prétendre madame destin obtenir lien rompre joindre seul répondre tenir aimer assurer tendre accorder croire grâce 
27	0.0773	aimer monsieur madame homme bon coeur trouver chose demander laisser amour tenir épouser entendre dorer crois penser fâcher agir maître plaire adieu raison petit femme maîtresse rester comtesse aimable monde arriver prier vrai mariage attendre comte regarder croire répondre passer perdre mot valoir beau vérité tromper retirer paraître question plaisir 
28	0.13048	honneur vertu gloire bien digne haut faveur rang prix noble fortune même mériter mérite généreux âme nom beau illustre naissance éclat bonheur mépris estime sang rare ciel élever glorieux indigne grandeur effet honte estimer vain grâce respect bonté souffrir sort présent recevoir mettre orgueil exploit ingrat bienfait homme honorer heureux 
29	0.0466	monsieur femme homme bon petit trouver mari gens monde mettre fille jours beau chose connaître joli pari tenir entendre diable jeune crois être appeler temps maison air chambre pauvre porter mois demander carrosse qualité ville fois servir premier marier raison plaire esprit mourir attendre arriver passer fortune mariage dame laisser 
30	0.00617	avoir petit être cheval côté jeter chapeau monter bouvillon savant genre pied porter vie échelle cause tête individu poisson pierre gentilhomme la marcher bête envoyer imagination manteau barbe matière pendre cul court tonneau selle dominer mer armes bras corne jambe courir bière règle jean sonner terre usage choisir horloge mousqueton 
31	0.08874	père fille famille fils mère gendre nom enfant aimer apprendre jeune maison époux attendre bien âge parent entendre sortir épouser honneur obéir entrer défendre destiner regarder naître embrasser prétendre vieux taire lieu permettre oser juste choix nommer choisir espérer ordre consentir parti pays agir côté préférer paternel approcher part perdre 
32	0.02317	portrait visage yeux beau peindre tableau beauté traits couleur laisser regarder vrai peinture front peintre miroir main charmer teint cheveux taille faux montrer sembler devenir original admirer présent blanc pinceau histoire ressembler vif noir écouter marquer figure imaginer paraître nature oeil couvrir soleil image long haut bouche apporter jeter côté 
33	0.00849	monsieur avocat plaider juge procès affaire juger drap cause bon payer justice guillaume écus fait audience moutons procureur père droit argent tuer tête clerc sergent partie matin mourir exploit arrêt avouer huissier aune voler feu condamner ouïr voleur pendre robe jour entendre pistole plaideur procédure emporter paix mouton dîner manger 
34	0.15617	sang main dieux mort fureur horreur ciel yeux crime cruel mourir bras affreux fils coup venger lieux père barbare malheureux vengeance cri punir funeste tyran fuir frapper époux entendre moment sort tomber victime voix fer pleur immoler forfait courroux trépas vie horrible malheur coeur seul mère frémir seigneur sein jour 
35	0.04234	dessein soin loi servir coup effet premier mettre haine puissance temps autorité succès repos esprit justice intérêt porter par crédit parti bras maison prince effort soumettre sentiment passion entreprendre avis avoir propre caprice commun mouvement faveur produire tête choquer paix liberté éclat motif emploi différent fondement fruit fatal être main 
36	0.09618	loi peuple coeur maître ami connaître main servir nom courage tyran temps patrie fier vertu sang porter guerrier oser trône nouveau vainqueur droits mortel héros esclave citoyen apprendre honneur destin vain heureux doute murs faible sacrer soldat paix univers fers humains voix joug vil lieux craindre sein barbare soumettre crois 
37	0.04183	dieux autel dieu temple loi ciel sacrer sacrifice terre peuple saint voeu même main mortel immortel mort auguste éternel victime jour coeur pied voix respecter prêtre exemple attendre porter bûcher horreur recevoir jurer encens serment oser pur premier suprême nature paix erreur sort consacrer oracle tombeau humains servir lieu préparer 
38	0.12326	trône régner reine prince empire sceptre rang couronne sang peuple sujet seigneur grandeur main loi choix seul ambition maître souverain couronner mettre craindre puissance diadème monter laisser orgueil droit vertu gloire naître princesse coeur monarque ciel frère digne fils choisir haut connaître père élever titre suprême dieux droits yeux cour 
39	0.18342	mort mourir sang vie venger sauver perdre main coup périr sort trépas crime vivre fureur vengeance haine dieux laisser amour bras tyran jours punir gloire madame servir cruel honneur seul ennemi victime immoler lâche perte jour effort courroux suivre attendre juste offrir digne généreux colère envie conserver rage dessein courage 
40	0.02236	bon madame plaisir petit heureux finette plaire tante affaire jeune chose enfant devenir sage merlin manière moins attendre affaires fou maître moment aimer fait seul amoureux joli nièce cher trouver mauvais penser paraître aimable temps amant perdre abord femme dessein peine chagrin esprit raison sûr content certain hasard soin suite 
41	0.08186	mourir mort corps main sang douleur yeux coup âme vie trépas beau dernier pleurer coeur bras vivre pleur fer tomber sentir perdre percer poison peine tombeau objet sein mots visage regret horreur tuer triste porter rester passer avoir femme larme son rage effort mettre oeil ravir laisser funeste regarder deuil 
42	0.12266	honneur esprit raison dessein suivre âme femme mettre discours perdre souffrir homme tenir chose bon mal conseil mauvais servir vertu résoudre porter bien trouver obliger sujet sentiment passer respect effet désir point loi action connaître lâche envie avis penser agir vie ôter juste peur offenser traiter violence colère temps car 
43	0.02171	vers auteur pièce beau lire ouvrage nom esprit théâtre esprits jouer poète comédie acteur art talent sonnet sujet trouver rime bon écrit génie scène prose seul rôle public mettre nouveau temps muse écrire rire premier goût apollon commencer titre style métier voler mauvais appeler sens rimer mots savant merveille produire 
44	0.01526	prince sire nom habit trouver fou sosie habits coup infant valeur mettre amphitryon guerre terre gens bon bois princesse port épée guerrier passer rencontrer tête altesse cour entrer qualité assassin soldat plaire paix malheur chasser tuer province récit mauvais malheureux apporter car armes chasse reconnaître cheval approcher dieux maison peine 
45	0.18885	coeur amour oser gloire madame espoir craindre aimer croire souffrir seul vain hymen voeu laisser connaître foi âme peine éclat offrir flamme vertu secret zèle effort flatter sort aveu ardeur orgueil presser doux forcer mériter intérêt plaire chercher ordre choix plaindre trahir obtenir destin avoir refus assurer soin prix moins 
46	0.05959	ciel songe nuit esprit ombre dieu âme yeux voix sens lumière soleil terre homme cieux lieux jour vain clarté esprits sommeil traits divin sombre suivre horreur corps même tomber éternel image fois trouver univers nature effroi crainte troubler entendre foudre air instant noir repos enfer objet frapper plein astre céleste 
47	0.13846	combat gloire victoire ennemi bras vainqueur vaincre coeur armes courage valeur combattre soldat coup camp main guerre honneur armée effort triompher paraître suivre seul sang exploit guerrier ville paix tomber perdre succès animer généreux triomphe attaquer craindre force chef laurier tenir soutenir armer dernier glorieux porter bruit beau ardeur premier 
48	0.0222	beau bois berger fleur arbre main eau lieu rocher jardin pied fruit riche animal fontaine pauvre nymphe forêt nature paraître petit trésor oiseau côté approcher apercevoir pasteur grotte passer soleil milieu champs bord charmer air village remarquer jeter pitié récit former agréable bergère habit désert troupeau vers différent endroit chose 
49	0.03559	dieux terre enfer feu air monde monstre corps eau jour cieux tonnerre univers soleil nature rage rocher mont mortel guerre courir lion peine ombre fuir serpent oeil fin mer enfant flamme fureur élément ciel beau temps pluton allumer nouveau noir accident foudre furieux colère mort poudre las brûler seul pareil 
50	0.05403	monsieur homme chose bon laisser gens mettre monde plaire affaire petit prier beau maître tenir demander croire honneur trouver coquin vrai moquer coup foi personne raison être songer honnête grâce pauvre heure dieu tort promettre crois souffrir demeurer fois coeur passer femme côté mot entendre plaisir chercher méchant obliger ferai 
51	0.04616	porte nuit sortir chambre entrer dormir entendre heure bruit jour trouver logis maison ouvrir attendre passer peur lit fermer rue seul craindre arriver frapper penser ami crois chercher monter moment doute ouvre revenir courir éveiller coup coucher tenir point fenêtre retirer matin sorte manquer jardin descendre homme tort rentrer maîtresse 
52	0.00725	monseigneur gouverneur chevalier seigneur beau acanthe enchanteur bon château don village bailli maître mathurin blondel gouvernement duc honneur jour délivrer pays finir richard gouverner île lire diable écouter gens paysan vieux dame laure histoire enchantement ducat aveugle aventure ouïr écuyer fou terre par williams excellence errant pauvre soldat maison bonheur 
53	0.04978	romain dieux homme vertu sénat nom patrie consul gloire liberté tyran main empereur fers héros maître ennemi craindre honneur univers ami esclave seul oser empire peuple vie soldat monde noble digne intérêt trembler grandeur sang sauver soumettre citoyen aigle capitole fois conjuré état premier servir plaindre moment ordre chef agripper 
54	0.04815	trouver chose raison vie homme père être sentiment résoudre passion personne demander honneur monde laisser obliger femme parole fortune liberté recevoir fille sorte conseil conseiller connaître saurais refuser action tenir dessein servir résolution persuader empêcher inclination dépendre mort dernier mettre même nature souhaiter ennemi amour chercher défendre volonté avantage offrir 
55	0.0967	fils père mère frère sang enfant nom jour nature cher naître seigneur naissance amour laisser seul tendresse malheureux fille yeux hymen secret âge perdre vie espérer mourir sentir temps jeune reconnaître fois joie embrasser connaître paix prince passer peine heureux sortir trouver paternel cacher commencer taire devenir conserver enfance être 
56	0.07628	monsieur bon esprit homme air plaire ami raison monde gens sage plaisir crois sot fond heureux mot penser femme beau sortir instant goût mettre âge marquis vrai devenir paraître croire tort art haut sûr bien grâce cas compter sentir défalloir convenir rire caractère tenir fou bonheur occuper ridicule tour temps 
57	0.21624	malheur mal mourir mort douleur sort perdre ciel triste vivre plaindre malheureux cruel souffrir vie pleur destin peine trépas funeste laisser état coup suivre bonheur âme ennui désespoir bien heureux ôter changer pitié affliger quitter finir rigueur perte dieux trouver misère dernier cher craindre larme consoler seul tourment fortune doux 
58	0.25154	attendre suivre laisser partir sortir ami chercher fuir temps pas trouver soin courir quitter connaître dessein craindre moment peine lieu lieux bruit entendre arrêter cacher perdre main conduire même seul ciel ordre secret sauver yeux mettre songer revenir passer adieu paraître croire chemin servir garder retour assurer apprendre arriver vie 
59	0.07366	crime coupable traître innocence attentat innocent horreur forfait criminel seigneur noir accuser lâche sang perfide punir soupçon complice perdre supplice trahison oser remord fureur mort main seul parricide rage commettre justice justifier conspirer découvrir ingrat craindre vertu juge trahir haine imposture soupçonner dessein zèle apprendre artifice odieux périr reine paraître 
60	0.00876	ciel homme vie monde âme action parole vivre don porter mettre tendresse humain coeur vice discours repentir pensée crois toucher joie larme voeu inspirer doux scélérat songer chose conduite saint avis vrai grâce même dévot ardeur zèle changement pauvre pousser tomber gens passion yeux profiter manière transports vertu souffrir corriger 
61	0.13248	aimer amour coeur ingrat venger trahir foi rival perfide amant traître infidèle mépris haïr crime perdre courroux punir honte âme raison colère objet cruel yeux plaire trahison laisser lâche sortir seul vengeance haine penser dieux oublier injure serment connaître sujet flamme affront quitter offenser crois parjure servir infidélité jaloux changer 
62	0.00677	dieu cour bien avoir être pauvre princesse par courir recevoir perdre penser bague beau cher ravir tenir souffrir vrai bon monseigneur obéir couvrir entier mots mettre maman germain mal ouïr dame ancien fait joyau loup fonds divin égard même visiter terme épouse marcher sujet cours valet main arrêter poursuivre henry 
63	0.02417	don honneur trouver homme monsieur ami battre fille bon valet cousin cavalier aimer frère gendre mal nom cacher chose taire avoir dieu entrer soeur brave espérer affaire nuit dame offense bien apprendre chercher tuer malheur cher recevoir parole chambre mort oser vieillard combat comte offenser ennemi même fois paraître hasarder 
64	0.03626	monsieur argent bon écus payer perdre franc compter mettre affaire jouer billet affaires pistole attendre somme gagner prêter maître ami papier valoir louis vendre diable jeu main temps honnête passer fortune notaire livres bourse fois compte espèce moins petit ruiner cher voler manquer adieu enfant besoin fripon dette maîtresse acheter 
65	0.03709	femme fille mari enfant mariage marier bon petit beau jeune épouser maison mère bien tête père entendre aimer sot chose plaire vieux âge dieu cher gens sage vrai noce mettre fou raison monde président vivre homme affaire soir aîné fait gendre famille époux plaisir sentir foi lire ménage hymen pleurer 
66	0.08414	madame mère croire laisser chose vrai attendre mettre grâce entendre moment présent aimer trouver paraître assurer revenir connaître demander entrer perdre prier vie main ordre permettre bonté sortir monde ciel doute bonheur temps souvenir écouter pardonner liberté peine taire intérêt oublier part obéir époux cru pourvoir mérite recevoir jeter répondre 
67	0.02355	dieu chrétien ciel saint loi seigneur enfant autel erreur foi temple zèle religion peuple prêtre main cieux cher suivre culte terre adorer vivre lieu empereur voix flamme juif divin exemple impie supplice monde pied même ange seul tyran vérité ennemi puissant abandonner infidèle braver bonté recevoir tourment crainte conserver éternel 
68	0.10838	amour âme aimer perdre souffrir craindre oser tenir effet mettre main laisser suivre lieu porter servir choix nouveau attendre vain traiter haine faveur rival temps même montrer loi choisir yeux courage trouver voeu objet bon part amant peine ami quitter doux assurer reste flamme rompre ordre recevoir passer haïr grâce 
69	0.0694	seigneur prince princesse demander coeur paix ordre laisser foi apprendre maître main intérêt croire promettre raison oser penser sujet grâce honneur connaître guerre répondre zèle romain ordonner cour choix mettre seul refuser parole servir remplir heureux dieux expliquer accorder politique ambassadeur juger regarder avouer entendre pareil mériter souverain garder digne 
